{"$schema":"https://json-schema.org/draft/2020-12/schema","title":"LazySeries Generated Host Mirror","type":"object","additionalProperties":false,"required":["schema_version","contract_version","record_type","mirror_id","source_observation_id","host","status","canonical_owner","surface","value_digest"],"properties":{"schema_version":{"const":1},"contract_version":{"const":"1.0.0"},"record_type":{"const":"generated-mirror"},"mirror_id":{"$ref":"lazyseries-host-evidence-defs.v1.schema.json#/$defs/id"},"source_observation_id":{"$ref":"lazyseries-host-evidence-defs.v1.schema.json#/$defs/id"},"host":{"$ref":"lazyseries-host-evidence-defs.v1.schema.json#/$defs/host"},"status":{"enum":["mirrored","unsupported"]},"canonical_owner":{"const":"package"},"surface":{"$ref":"lazyseries-host-evidence-defs.v1.schema.json#/$defs/surface"},"value_digest":{"$ref":"lazyseries-host-evidence-defs.v1.schema.json#/$defs/sha256"}}}
