{"schema_version":1,"contract_version":"1.0.0","record_type":"generated-mirror","mirror_id":"mirror:001","source_observation_id":"obs:001","host":"codebuddy-cli","status":"mirrored","canonical_owner":"package","surface":{"surface_id":"codebuddy-cli:session","native_mode":"observe-only","host_authority":"host","package_owner":"LazyBuddy","direction":"host-to-package","merge_key":"codebuddy-cli:session","base_digest":"aaaaaaaaaaaaaaaaaaaaaaaaaaaaaaaaaaaaaaaaaaaaaaaaaaaaaaaaaaaaaaaa","freshness":{"status":"current","observed_at":"2026-08-03T09:00:00Z","expires_at":"2026-08-03T11:00:00Z"},"source_receipt":{"receipt_id":"source:001","sha256":"bbbbbbbbbbbbbbbbbbbbbbbbbbbbbbbbbbbbbbbbbbbbbbbbbbbbbbbbbbbbbbbb","redacted":true}},"value_digest":"cccccccccccccccccccccccccccccccccccccccccccccccccccccccccccccccc"}
